{
  "$id": "urn:ratatoskr:contracts:events:v1:NotificationRaised",
  "$schema": "https://json-schema.org/draft/2020-12/schema",
  "title": "NotificationRaised",
  "description": "Payload of `platform.notification.raised.v1`: a producer judged that one of its users should\nbe told something.\n\nA fact, not an order (`AGENTS.md` principle 9): by the time this payload exists the judgment\nis complete, and whether a message is actually sent — preference filtering, dedupe, quiet\nhours, channel choice — is `ratatoskr-telegram`'s decision. The aggregate identifier of the\ncarrying envelope names the raised notification itself as `notification:<uuid>`, because the\nnotification is what consumers acknowledge, suppress and dedupe; its identity is never\nborrowed from the causing operation or analysis.\n\nThe only cross-field invariant today is the taxonomy registry floor, but `Deserialize` is\nhand-written anyway, following the crate family's checked-intermediate pattern: a private\nwire mirror parses field by field, then [`Self::validate`] runs. A field added to the public\nstruct and not to the mirror would be silently dropped; the full-payload fixture round trips\nthrough `cargo contracts check`, which fails the moment that happens. Do not add a field to\none of these structs alone.",
  "type": "object",
  "properties": {
    "analysis_ref": {
      "description": "The knowledge analysis this notification belongs to, when one does. Optional; opaque to\nthis crate in the same way as `operation_ref`.",
      "anyOf": [
        {
          "$ref": "#/$defs/EntityRef"
        },
        {
          "type": "null"
        }
      ]
    },
    "class": {
      "description": "Which kind of thing happened. Required; see [`NotificationClass`]. Unknown tokens are\npreserved verbatim, never rejected.",
      "$ref": "#/$defs/NotificationClass"
    },
    "class_registry_version": {
      "description": "Registry version of the class taxonomy the producer speaks. Required; greater than zero.\nA consumer that knows only registry version 1 reads a higher version as \"may carry classes\nI will hold as preserved\".",
      "type": "integer",
      "format": "uint32",
      "minimum": 0
    },
    "message": {
      "description": "Longer carrier-safe detail. Optional and omitted when absent; producers keep it\nsummary-level — secrets and raw provider content travel elsewhere, never here.",
      "anyOf": [
        {
          "$ref": "#/$defs/SafeMessage"
        },
        {
          "type": "null"
        }
      ]
    },
    "notification_id": {
      "description": "Identity of this raised notification. Required. Bare canonical lowercase hyphenated UUID;\nalso the logical key a consumer uses to recognize the same notification re-raised under a\nnew transport event id.",
      "$ref": "#/$defs/NotificationId"
    },
    "operation_ref": {
      "description": "The operation this notification belongs to, when one does. Optional; opaque to this crate:\nthe open `<kind>:<local_id>` pointer grammar applies and no referent kind is interpreted.\nShould equal the carrying envelope's `correlation_id` when present.",
      "anyOf": [
        {
          "$ref": "#/$defs/EntityRef"
        },
        {
          "type": "null"
        }
      ]
    },
    "priority_hint": {
      "description": "Producer-asserted urgency judgment. Optional; advisory only, enforced by nobody on this\nside of the wire. Absent means the consumer's default ordering applies.",
      "anyOf": [
        {
          "$ref": "#/$defs/NotificationPriority"
        },
        {
          "type": "null"
        }
      ]
    },
    "quiet_hours": {
      "description": "A daily window during which delivery should be held back. Optional; advisory only, and\ninterpreted by the consumer against timezone and preference data it owns.",
      "anyOf": [
        {
          "$ref": "#/$defs/QuietHoursHint"
        },
        {
          "type": "null"
        }
      ]
    },
    "recipient": {
      "description": "The one user this notification concerns. Required; closed tenancy grammar `user:<uuid>`.\nWhen the carrying envelope names a tenant at all, it names the same user.",
      "$ref": "#/$defs/TenantRef"
    },
    "title": {
      "description": "Short carrier-safe headline. Required; see `SafeMessage`.",
      "$ref": "#/$defs/SafeMessage"
    }
  },
  "additionalProperties": true,
  "required": [
    "class",
    "class_registry_version",
    "notification_id",
    "recipient",
    "title"
  ],
  "x-ratatoskr-provenance": {
    "canonical_source": "ratatoskr_notification_contracts::NotificationRaised",
    "contract_id": "platform.notification_raised",
    "contract_major_version": 1,
    "generated": "DO NOT EDIT — generated by contractsc from the canonical Rust source. Change the Rust type and run `cargo contracts generate`.",
    "generator": "contractsc",
    "generator_version": "0.1.0",
    "schemars_version": "1.2.2",
    "source_digest": "sha256:2e77070288f7d617d31ac9d8b011a503cd632e939021244e37585edf14797246",
    "validation_note": "This schema is a LOWER BOUND on validity. Cross-field invariants and canonical-form rules are enforced by the canonical Rust type; see fixtures/invalid-expectations.toml for which layer rejects what."
  },
  "x-ratatoskr-unknown-policy": "preserve",
  "$defs": {
    "EntityRef": {
      "title": "EntityRef",
      "description": "A namespaced, polymorphic wire reference, serialized as `<kind>:<local_id>`. The kind vocabulary is open: an unrecognised kind is preserved verbatim. The local identity is opaque and need not be a UUID; when it is one it must be the canonical lowercase hyphenated spelling, so one identity has one reference. Equality is octet equality of `<kind>:<local_id>`: the kind is lowercase by grammar, and the local part is case-sensitive and never case-folded, because provider identities are case-significant. This rule is narrower than the `pattern` below, which cannot express it.",
      "type": "string",
      "examples": [
        "document:018f0000-0000-7000-8000-000000000002",
        "x-post:123"
      ],
      "maxLength": 289,
      "pattern": "^[a-z][a-z0-9_-]{0,31}:[A-Za-z0-9][A-Za-z0-9._~:@+-]{0,255}$"
    },
    "NotificationClass": {
      "title": "NotificationClass",
      "description": "A notification-class taxonomy token. Snake_case segments, at most 32 UTF-8 bytes. Unknown tokens are preserved verbatim, never rejected; an input that violates this pattern is a typo or hostile rather than future vocabulary.",
      "type": "string",
      "examples": [
        "operation_completed",
        "analysis_ready"
      ],
      "maxLength": 32,
      "pattern": "^[a-z][a-z0-9_-]{0,31}$"
    },
    "NotificationId": {
      "title": "NotificationId",
      "description": "Identity of one raised user-facing notification. Bare canonical lowercase hyphenated UUID; not namespaced.",
      "type": "string",
      "format": "uuid",
      "examples": [
        "018f0000-0000-7000-8000-000000000001"
      ],
      "pattern": "^[0-9a-f]{8}-[0-9a-f]{4}-[0-9a-f]{4}-[0-9a-f]{4}-[0-9a-f]{12}$"
    },
    "NotificationPriority": {
      "description": "How urgently a producer judges its notification should reach the user.\n\nA **hint, never an order**: enforcement stays with `ratatoskr-telegram`, which applies it\nthrough the user's own preferences. Absent means the consumer's default ordering applies.\n\n**Closed on purpose**, mirroring `BackupPriorityHint`: a guessed priority silently reorders\ndelivery, so an unrecognized value must stop processing rather than be read as some default.\nAdding a level later is an additive, non-breaking expansion governed by the payload major,\nnot by the class registry — priority is not part of the taxonomy.",
      "oneOf": [
        {
          "description": "Deliver only when the channel is otherwise idle; the news keeps.",
          "type": "string",
          "const": "low"
        },
        {
          "description": "Ordinary delivery.",
          "type": "string",
          "const": "normal"
        },
        {
          "description": "Deliver promptly and let it break through quiet hours where the user's own preferences\nallow that at all.",
          "type": "string",
          "const": "high"
        }
      ]
    },
    "QuietHoursHint": {
      "title": "QuietHoursHint",
      "description": "A recurring daily window during which notification delivery should be held back, advisory only. Two offsets from UTC midnight in seconds; a start greater than the end wraps past midnight. Equal bounds are refused by the Rust type - they cannot say whether they mean an empty day or a full one - which this schema cannot express.",
      "type": "object",
      "properties": {
        "end_offset_seconds": {
          "description": "Seconds after UTC midnight at which the window closes; smaller than the start when the window wraps past midnight.",
          "type": "integer",
          "format": "uint32",
          "maximum": 86399,
          "minimum": 0
        },
        "start_offset_seconds": {
          "description": "Seconds after UTC midnight at which the window opens.",
          "type": "integer",
          "format": "uint32",
          "maximum": 86399,
          "minimum": 0
        }
      },
      "required": [
        "end_offset_seconds",
        "start_offset_seconds"
      ]
    },
    "SafeMessage": {
      "title": "SafeMessage",
      "description": "Human-readable text safe to show to an operator or an end user.\n\n1..=1024 characters with no C0 or DEL control characters. The newline ban is the point: it\nmakes it structurally impossible to smuggle a stack trace or a forged log line into a wire\nmessage (`ARCHITECTURE.md` S5.5 \"no stack traces or secrets in wire errors\", S14).\n\nNot machine-parsed and not stable across releases; changing a message is not a contract\nchange. Consumers branch on codes, never on this.",
      "type": "string",
      "examples": [
        "The requested document does not exist."
      ],
      "maxLength": 1024,
      "pattern": "^[^\\x00-\\x1f\\x7f]{1,1024}$"
    },
    "TenantRef": {
      "title": "TenantRef",
      "description": "The owner of the data a record concerns, wire form `user:<uuid>`. The kind set is closed: a consumer that cannot understand the owner kind must reject the record rather than process it.",
      "type": "string",
      "examples": [
        "user:018f0000-0000-7000-8000-000000000005"
      ],
      "maxLength": 41,
      "pattern": "^user:[0-9a-f]{8}-[0-9a-f]{4}-[0-9a-f]{4}-[0-9a-f]{4}-[0-9a-f]{12}$"
    }
  }
}
